{
  "$schema": "../../schema/problem.schema.json",
  "schemaVersion": 1,
  "id": "cses-1651",
  "status": "draft",
  "title": "Range Update Queries",
  "source": "CSES",
  "url": "https://cses.fi/problemset/task/1651",
  "difficulty": {
    "tier": "easy",
    "scale": "estimate",
    "value": "E"
  },
  "summary": "",
  "constraints": {
    "text": "n, q ≤ 2e5, range add + point query",
    "verified": false
  },
  "answers": {
    "subjects": [
      {
        "id": "segtree",
        "role": "intended"
      }
    ],
    "techniques": [
      {
        "id": "segtree.fenwick-difference",
        "role": "intended"
      },
      {
        "id": "segtree.segtree-lazy",
        "role": "overkill"
      }
    ]
  },
  "distractors": [
    "segtree.prefix-sums",
    "segtree.segtree-point"
  ],
  "explanation": "Range add with only point reads: a BIT over the difference array — no lazy propagation needed.",
  "traps": [],
  "pairWith": [],
  "extraLayers": [],
  "deprecated": false
}
