{
  "$schema": "../../schema/problem.schema.json",
  "schemaVersion": 1,
  "id": "cf-782b",
  "status": "draft",
  "title": "The Meeting Place Cannot Be Changed",
  "source": "Codeforces",
  "url": "https://codeforces.com/problemset/problem/782/B",
  "difficulty": {
    "tier": "medium",
    "scale": "cf",
    "value": "1600"
  },
  "summary": "",
  "constraints": {
    "text": "n ≤ 6e4, answer within 1e-6",
    "verified": true
  },
  "answers": {
    "subjects": [
      {
        "id": "bsearch-dnc",
        "role": "intended"
      }
    ],
    "techniques": [
      {
        "id": "bsearch-dnc.on-reals",
        "role": "intended"
      },
      {
        "id": "bsearch-dnc.ternary",
        "role": "accepted"
      }
    ]
  },
  "distractors": [
    "bsearch-dnc.on-answer",
    "geometry.circles"
  ],
  "explanation": "Binary search the time T: everyone can meet iff their reachable intervals intersect. Use ~100 fixed iterations.",
  "traps": [
    "A while (r − l > eps) loop can spin forever on doubles."
  ],
  "pairWith": [],
  "extraLayers": [],
  "deprecated": false
}
